{
  "app": "ft_e2e",
  "devices": [
    {
      "platform": "ios",
      "machine": "local",
      "name": "iPhone 17(iOS 27.0)",
      "enabled": false,
      "model": "iPhone 17",
      "osVersion": "iOS 27.0",
      "udid": "6109860E-93CE-47E1-9989-5DCD16186434"
    },
    {
      "platform": "ios",
      "machine": "local",
      "name": "iPhone 17 Pro(iOS 27.0)-01",
      "model": "iPhone 17 Pro",
      "osVersion": "iOS 27.0",
      "udid": "E38DCA93-95F2-4DDF-B1FE-29527205D3EE"
    },
    {
      "platform": "ios",
      "machine": "local",
      "name": "iPhone 17 Pro(iOS 27.0)-02",
      "model": "iPhone 17 Pro",
      "osVersion": "iOS 27.0",
      "udid": "C96A69C4-FE49-42EE-8C7F-ED5F603C346B"
    },
    {
      "platform": "ios",
      "machine": "local",
      "name": "iPhone 17 Pro(iOS 27.0)-03",
      "model": "iPhone 17 Pro",
      "osVersion": "iOS 27.0",
      "udid": "B422AB58-6C79-45BC-92F0-BEF88061C8E1"
    },
    {
      "platform": "ios",
      "machine": "local",
      "name": "iPhone 17 Pro(iOS 27.0)-04",
      "model": "iPhone 17 Pro",
      "osVersion": "iOS 27.0",
      "udid": "2C4FBE2E-5358-48CD-B32A-964B8EB817B4"
    },
    {
      "platform": "ios",
      "machine": "local",
      "name": "iPhone 17 Pro(iOS 27.0)-05",
      "model": "iPhone 17 Pro",
      "osVersion": "iOS 27.0",
      "udid": "61A7E615-9C85-438E-BE3D-1BAC78640B11"
    },
    {
      "platform": "ios",
      "machine": "local",
      "name": "iPhone 17 Pro(iOS 27.0)-06",
      "model": "iPhone 17 Pro",
      "osVersion": "iOS 27.0",
      "udid": "26FB5C4F-28B3-42D0-BB3A-A7B4D63917FF"
    },
    {
      "platform": "ios",
      "machine": "local",
      "name": "iPhone 17 Pro(iOS 27.0)-07",
      "model": "iPhone 17 Pro",
      "osVersion": "iOS 27.0",
      "udid": "0B7E3ADA-B0E7-4A5B-99A7-B29091AE547A"
    },
    {
      "platform": "ios",
      "machine": "local",
      "name": "iPhone 17 Pro(iOS 27.0)-08",
      "model": "iPhone 17 Pro",
      "osVersion": "iOS 27.0",
      "udid": "257324AF-D10D-42DE-AD7D-ADB682E8365F"
    },
    {
      "platform": "ios",
      "machine": "local",
      "name": "iPhone 17 Pro(iOS 27.0)-09",
      "enabled": false,
      "model": "iPhone 17 Pro",
      "osVersion": "iOS 27.0",
      "udid": "2A7FBD43-4A72-44DA-AB95-EED23B1B3B6D"
    },
    {
      "platform": "ios",
      "machine": "local",
      "name": "iPhone 17 Pro(iOS 27.0)-10",
      "enabled": false,
      "model": "iPhone 17 Pro",
      "osVersion": "iOS 27.0",
      "udid": "AF99951F-FB48-4D6A-9BB2-BBCE8CFEEC8B"
    },
    {
      "platform": "ios",
      "machine": "M1Max",
      "name": "iPhone 17 Pro(iOS 27.0)-01",
      "model": "iPhone 17 Pro",
      "osVersion": "iOS 27.0",
      "udid": "58CC649F-31C3-4AAA-911A-0BF693395FFD"
    },
    {
      "platform": "ios",
      "machine": "M1Max",
      "name": "iPhone 17 Pro(iOS 27.0)-02",
      "model": "iPhone 17 Pro",
      "osVersion": "iOS 27.0",
      "udid": "400455DE-CDD5-486B-BD3D-42E95202EE40"
    },
    {
      "platform": "ios",
      "machine": "M1Max",
      "name": "iPhone 17 Pro(iOS 27.0)-03",
      "model": "iPhone 17 Pro",
      "osVersion": "iOS 27.0",
      "udid": "67F9FCA1-95FC-45C9-8EB5-D0408C5BFCCF"
    },
    {
      "platform": "ios",
      "machine": "M1Max",
      "name": "iPhone 17 Pro(iOS 27.0)-04",
      "model": "iPhone 17 Pro",
      "osVersion": "iOS 27.0",
      "udid": "490372D0-56A1-45C0-A806-E80AE822E1E4"
    },
    {
      "platform": "ios",
      "machine": "M1Ultra",
      "name": "iPhone 17 Pro(iOS 27.0)-01",
      "model": "iPhone 17 Pro",
      "osVersion": "iOS 27.0",
      "udid": "E1A517B3-2E0A-45AD-9C32-38AF315F39F7"
    },
    {
      "platform": "ios",
      "machine": "M1Ultra",
      "name": "iPhone 17 Pro(iOS 27.0)-02",
      "model": "iPhone 17 Pro",
      "osVersion": "iOS 27.0",
      "udid": "D5D8497F-CCBB-4FD4-A003-792EE592FBE1"
    },
    {
      "platform": "ios",
      "machine": "M1Ultra",
      "name": "iPhone 17 Pro(iOS 27.0)-03",
      "model": "iPhone 17 Pro",
      "osVersion": "iOS 27.0",
      "udid": "D1DF733B-FF67-43B3-888E-129F1FF4BAFC"
    },
    {
      "platform": "ios",
      "machine": "M1Ultra",
      "name": "iPhone 17 Pro(iOS 27.0)-04",
      "model": "iPhone 17 Pro",
      "osVersion": "iOS 27.0",
      "udid": "95212B76-43ED-4F10-9421-93485C5FBF7A"
    },
    {
      "platform": "ios",
      "machine": "M1Ultra",
      "name": "iPhone 17 Pro(iOS 27.0)-05",
      "model": "iPhone 17 Pro",
      "osVersion": "iOS 27.0",
      "udid": "9110CD4C-DE42-49CD-A278-18A580DA5094"
    },
    {
      "platform": "ios",
      "machine": "M1Ultra",
      "name": "iPhone 17 Pro(iOS 27.0)-06",
      "model": "iPhone 17 Pro",
      "osVersion": "iOS 27.0",
      "udid": "6C7ADCB9-B221-4377-85BA-5258DEC86C69"
    },
    {
      "platform": "ios",
      "machine": "M1mini",
      "name": "iPhone 17 Pro(iOS 27.0)-01",
      "model": "iPhone 17 Pro",
      "osVersion": "iOS 27.0",
      "udid": "A10076A6-6ED1-4A96-AA61-2514434BA0CA"
    },
    {
      "platform": "ios",
      "machine": "M1mini",
      "name": "iPhone 17 Pro(iOS 27.0)-02",
      "enabled": false,
      "model": "iPhone 17 Pro",
      "osVersion": "iOS 27.0",
      "udid": "5E95BF7A-A29C-4244-B5F9-9C8611124AAD"
    },
    {
      "platform": "android",
      "machine": "local",
      "name": "Pixel 9(Android 15)-01",
      "enabled": false,
      "avd": "Pixel_9_Android_15_-01"
    },
    {
      "platform": "android",
      "machine": "local",
      "name": "Pixel 9(Android 15)-02",
      "enabled": false,
      "avd": "Pixel_9_Android_15_-02"
    },
    {
      "platform": "android",
      "machine": "local",
      "name": "Pixel 9(Android 15)-03",
      "enabled": false,
      "avd": "Pixel_9_Android_15_-03"
    },
    {
      "platform": "android",
      "machine": "local",
      "name": "Pixel 9(Android 15)-04",
      "enabled": false,
      "avd": "Pixel_9_Android_15_-04"
    },
    {
      "platform": "android",
      "machine": "local",
      "name": "Pixel 9(Android 15)-05",
      "enabled": false,
      "avd": "Pixel_9_Android_15_-05"
    },
    {
      "platform": "android",
      "machine": "local",
      "name": "Pixel 9(Android 15)-06",
      "enabled": false,
      "avd": "Pixel_9_Android_15_-06"
    },
    {
      "platform": "android",
      "machine": "local",
      "name": "Pixel 9(Android 15)-07",
      "enabled": false,
      "avd": "Pixel_9_Android_15_-07"
    },
    {
      "platform": "android",
      "machine": "local",
      "name": "Pixel 9(Android 15)-08",
      "enabled": false,
      "avd": "Pixel_9_Android_15_-08"
    },
    {
      "platform": "android",
      "machine": "local",
      "name": "Pixel 9(Android 15)-09",
      "enabled": false,
      "avd": "Pixel_9_Android_15_-09"
    },
    {
      "platform": "android",
      "machine": "local",
      "name": "Pixel 9(Android 15)-10",
      "enabled": false,
      "avd": "Pixel_9_Android_15_-10"
    },
    {
      "platform": "android",
      "machine": "local",
      "name": "Pixel 4a",
      "enabled": false,
      "kind": "physical",
      "model": "Pixel 4a",
      "osVersion": "Android 13",
      "serial": "14141JEC204922"
    },
    {
      "platform": "android",
      "machine": "M1Max",
      "name": "Pixel 9(Android 15)-01",
      "enabled": false,
      "avd": "Pixel_9_Android_15_-01"
    },
    {
      "platform": "android",
      "machine": "M1Max",
      "name": "Pixel 9(Android 15)-02",
      "enabled": false,
      "avd": "Pixel_9_Android_15_-02"
    },
    {
      "platform": "android",
      "machine": "M1Max",
      "name": "Pixel 9(Android 15)-03",
      "enabled": false,
      "avd": "Pixel_9_Android_15_-03"
    },
    {
      "platform": "android",
      "machine": "M1Max",
      "name": "Pixel 9(Android 15)-04",
      "enabled": false,
      "avd": "Pixel_9_Android_15_-04"
    },
    {
      "platform": "android",
      "machine": "M1Ultra",
      "name": "Pixel 9(Android 15)-01",
      "enabled": false,
      "avd": "Pixel_9_Android_15_-01"
    },
    {
      "platform": "android",
      "machine": "M1Ultra",
      "name": "Pixel 9(Android 15)-02",
      "enabled": false,
      "avd": "Pixel_9_Android_15_-02"
    },
    {
      "platform": "android",
      "machine": "M1Ultra",
      "name": "Pixel 9(Android 15)-03",
      "enabled": false,
      "avd": "Pixel_9_Android_15_-03"
    },
    {
      "platform": "android",
      "machine": "M1Ultra",
      "name": "Pixel 9(Android 15)-04",
      "enabled": false,
      "avd": "Pixel_9_Android_15_-04"
    },
    {
      "platform": "android",
      "machine": "M1Ultra",
      "name": "Pixel 9(Android 15)-05",
      "enabled": false,
      "avd": "Pixel_9_Android_15_-05"
    },
    {
      "platform": "android",
      "machine": "M1Ultra",
      "name": "Pixel 9(Android 15)-06",
      "enabled": false,
      "avd": "Pixel_9_Android_15_-06"
    },
    {
      "platform": "android",
      "machine": "M1mini",
      "name": "Pixel 9(Android 15)-01",
      "enabled": false,
      "avd": "Pixel_9_Android_15_-01"
    },
    {
      "platform": "android",
      "machine": "M1mini",
      "name": "Pixel 9(Android 15)-02",
      "enabled": false,
      "avd": "Pixel_9_Android_15_-02"
    }
  ],
  "heal": true,
  "iosMode": "inapp-boost",
  "wipeDataOnBloat": true
}
