{
  "app": "ft_e2ex",
  "heal": true,
  "iosMode": "inapp-boost",
  "devices": [
    {
      "platform": "ios",
      "machine": "local",
      "name": "iPhone 17 Pro(iOS 27.0)-01",
      "model": "iPhone 17 Pro",
      "osVersion": "iOS 27.0",
      "enabled": true
    },
    {
      "platform": "ios",
      "machine": "local",
      "name": "iPhone 17 Pro(iOS 27.0)-02",
      "model": "iPhone 17 Pro",
      "osVersion": "iOS 27.0",
      "enabled": true
    },
    {
      "platform": "ios",
      "machine": "local",
      "name": "iPhone 17 Pro(iOS 27.0)-03",
      "model": "iPhone 17 Pro",
      "osVersion": "iOS 27.0",
      "enabled": true
    },
    {
      "platform": "ios",
      "machine": "local",
      "name": "iPhone 17 Pro(iOS 27.0)-04",
      "model": "iPhone 17 Pro",
      "osVersion": "iOS 27.0",
      "enabled": true
    },
    {
      "platform": "ios",
      "machine": "local",
      "name": "iPhone 17 Pro(iOS 27.0)-05",
      "model": "iPhone 17 Pro",
      "osVersion": "iOS 27.0",
      "enabled": true
    },
    {
      "platform": "ios",
      "machine": "local",
      "name": "iPhone 17 Pro(iOS 27.0)-06",
      "model": "iPhone 17 Pro",
      "osVersion": "iOS 27.0",
      "enabled": true
    },
    {
      "platform": "ios",
      "machine": "local",
      "name": "iPhone 17 Pro(iOS 27.0)-07",
      "model": "iPhone 17 Pro",
      "osVersion": "iOS 27.0",
      "enabled": true
    },
    {
      "platform": "ios",
      "machine": "local",
      "name": "iPhone 17 Pro(iOS 27.0)-08",
      "model": "iPhone 17 Pro",
      "osVersion": "iOS 27.0",
      "enabled": true
    }
  ]
}
