{
  "app": "ft_e2ex",
  "heal": true,
  "iosMode": "xcuitest",
  "devices": [
    {
      "platform": "android",
      "machine": "local",
      "name": "Pixel 9(Android 15)-01",
      "enabled": true,
      "avd": "Pixel_9_Android_15_-01"
    },
    {
      "platform": "android",
      "machine": "local",
      "name": "Pixel 9(Android 15)-02",
      "enabled": true,
      "avd": "Pixel_9_Android_15_-02"
    },
    {
      "platform": "android",
      "machine": "local",
      "name": "Pixel 9(Android 15)-03",
      "enabled": true,
      "avd": "Pixel_9_Android_15_-03"
    },
    {
      "platform": "android",
      "machine": "local",
      "name": "Pixel 9(Android 15)-04",
      "enabled": true,
      "avd": "Pixel_9_Android_15_-04"
    },
    {
      "platform": "android",
      "machine": "local",
      "name": "Pixel 9(Android 15)-05",
      "enabled": true,
      "avd": "Pixel_9_Android_15_-05"
    },
    {
      "platform": "android",
      "machine": "local",
      "name": "Pixel 9(Android 15)-06",
      "enabled": true,
      "avd": "Pixel_9_Android_15_-06"
    },
    {
      "platform": "android",
      "machine": "local",
      "name": "Pixel 9(Android 15)-07",
      "enabled": true,
      "avd": "Pixel_9_Android_15_-07"
    },
    {
      "platform": "android",
      "machine": "local",
      "name": "Pixel 9(Android 15)-08",
      "enabled": true,
      "avd": "Pixel_9_Android_15_-08"
    },
    {
      "platform": "android",
      "machine": "M1Max",
      "name": "Pixel 9(Android 15)-01",
      "avd": "Pixel_9_Android_15_-01"
    },
    {
      "platform": "android",
      "machine": "M1Max",
      "name": "Pixel 9(Android 15)-02",
      "avd": "Pixel_9_Android_15_-02"
    },
    {
      "platform": "android",
      "machine": "M1Max",
      "name": "Pixel 9(Android 15)-03",
      "avd": "Pixel_9_Android_15_-03"
    },
    {
      "platform": "android",
      "machine": "M1Max",
      "name": "Pixel 9(Android 15)-04",
      "avd": "Pixel_9_Android_15_-04"
    },
    {
      "platform": "android",
      "machine": "M1Ultra",
      "name": "Pixel 9(Android 15)-01",
      "avd": "Pixel_9_Android_15_-01"
    },
    {
      "platform": "android",
      "machine": "M1Ultra",
      "name": "Pixel 9(Android 15)-02",
      "avd": "Pixel_9_Android_15_-02"
    },
    {
      "platform": "android",
      "machine": "M1Ultra",
      "name": "Pixel 9(Android 15)-03",
      "avd": "Pixel_9_Android_15_-03"
    },
    {
      "platform": "android",
      "machine": "M1Ultra",
      "name": "Pixel 9(Android 15)-04",
      "avd": "Pixel_9_Android_15_-04"
    },
    {
      "platform": "android",
      "machine": "M1Ultra",
      "name": "Pixel 9(Android 15)-05",
      "avd": "Pixel_9_Android_15_-05"
    },
    {
      "platform": "android",
      "machine": "M1Ultra",
      "name": "Pixel 9(Android 15)-06",
      "avd": "Pixel_9_Android_15_-06"
    }
  ]
}
