{
  "app": "ft_e2e_ios",
  "devices": [
    {
      "platform": "ios",
      "machine": "local",
      "name": "iPhone Duo(iOS 27.2)-01",
      "model": "iPhone Duo",
      "osVersion": "iOS 27.2",
      "udid": "61C9B0E1-9F3C-475E-8DA9-24FF9C8BA684"
    },
    {
      "platform": "ios",
      "machine": "local",
      "name": "iPhone Duo(iOS 27.2)-02",
      "model": "iPhone Duo",
      "osVersion": "iOS 27.2",
      "udid": "16FC30F9-50CD-4364-AE7C-2860E6285B9F"
    }
  ],
  "heal": true,
  "iosMode": "inapp-boost",
  "wipeDataOnBloat": true
}
