{
  "app": "sampleapp_ios",
  "devices": [
    {
      "platform": "ios",
      "machine": "local",
      "name": "iPhone 17 Pro(iOS 27.0)-01",
      "model": "iPhone 17 Pro",
      "osVersion": "iOS 27.0",
      "udid": "E38DCA93-95F2-4DDF-B1FE-29527205D3EE"
    },
    {
      "platform": "ios",
      "machine": "local",
      "name": "iPhone 17 Pro(iOS 27.0)-02",
      "model": "iPhone 17 Pro",
      "osVersion": "iOS 27.0",
      "udid": "C96A69C4-FE49-42EE-8C7F-ED5F603C346B"
    },
    {
      "platform": "ios",
      "machine": "local",
      "name": "iPhone 17 Pro(iOS 27.0)-03",
      "model": "iPhone 17 Pro",
      "osVersion": "iOS 27.0",
      "udid": "B422AB58-6C79-45BC-92F0-BEF88061C8E1"
    },
    {
      "platform": "ios",
      "machine": "local",
      "name": "iPhone 17 Pro(iOS 27.0)-04",
      "enabled": false,
      "model": "iPhone 17 Pro",
      "osVersion": "iOS 27.0",
      "udid": "2C4FBE2E-5358-48CD-B32A-964B8EB817B4"
    },
    {
      "platform": "android",
      "machine": "local",
      "name": "Pixel 9(Android 15)-01",
      "avd": "Pixel_9_Android_15_-01"
    },
    {
      "platform": "android",
      "machine": "local",
      "name": "Pixel 9(Android 15)-02",
      "avd": "Pixel_9_Android_15_-02"
    },
    {
      "platform": "android",
      "machine": "local",
      "name": "Pixel 9(Android 15)-03",
      "avd": "Pixel_9_Android_15_-03"
    },
    {
      "platform": "android",
      "machine": "local",
      "name": "Pixel 9(Android 15)-04",
      "enabled": false,
      "avd": "Pixel_9_Android_15_-04"
    }
  ],
  "heal": true,
  "iosMode": "inapp-boost",
  "wipeDataOnBloat": true
}
