{
  "app": "sampleapp_ios",
  "devices": [
    {
      "platform": "ios",
      "machine": "M1Ultra",
      "name": "iPhone 17 Pro",
      "model": "iPhone 17 Pro",
      "osVersion": "iOS 27.0",
      "udid": "6E7FD226-DF38-477E-8BB4-6363B688946F"
    },
    {
      "platform": "android",
      "machine": "M1Ultra",
      "name": "Pixel 3(Android 11)-01",
      "enabled": false,
      "avd": "Pixel_3_Android_11_-01"
    }
  ],
  "heal": true,
  "iosMode": "inapp-boost",
  "wipeDataOnBloat": true
}
