{
  "app": "ft_e2e_ios",
  "devices": [
    {
      "platform": "ios",
      "machine": "M1Ultra",
      "name": "iPhone 17 Pro(iOS 27.0)-01",
      "model": "iPhone 17 Pro",
      "osVersion": "iOS 27.0",
      "udid": "E1A517B3-2E0A-45AD-9C32-38AF315F39F7"
    }
  ],
  "heal": true,
  "iosMode": "inapp-boost",
  "wipeDataOnBloat": true
}
