{
  "app": "sut-ec-mobile",
  "devices": [
    {
      "platform": "ios",
      "machine": "local",
      "name": "iPhone 17 Pro(iOS 27.0)-01",
      "enabled": false,
      "model": "iPhone 17 Pro",
      "osVersion": "iOS 27.0",
      "udid": "E38DCA93-95F2-4DDF-B1FE-29527205D3EE"
    },
    {
      "platform": "ios",
      "machine": "local",
      "name": "iPhone 17 Pro(iOS 27.0)-02",
      "enabled": false,
      "model": "iPhone 17 Pro",
      "osVersion": "iOS 27.0",
      "udid": "C96A69C4-FE49-42EE-8C7F-ED5F603C346B"
    },
    {
      "platform": "ios",
      "machine": "local",
      "name": "iPhone 17 Pro(iOS 27.0)-03",
      "enabled": false,
      "model": "iPhone 17 Pro",
      "osVersion": "iOS 27.0",
      "udid": "B422AB58-6C79-45BC-92F0-BEF88061C8E1"
    },
    {
      "platform": "ios",
      "machine": "local",
      "name": "iPhone 17 Pro(iOS 27.0)-04",
      "enabled": false,
      "model": "iPhone 17 Pro",
      "osVersion": "iOS 27.0",
      "udid": "2C4FBE2E-5358-48CD-B32A-964B8EB817B4"
    },
    {
      "platform": "ios",
      "machine": "local",
      "name": "iPhone 17 Pro(iOS 27.0)-05",
      "enabled": false,
      "model": "iPhone 17 Pro",
      "osVersion": "iOS 27.0",
      "udid": "61A7E615-9C85-438E-BE3D-1BAC78640B11"
    },
    {
      "platform": "ios",
      "machine": "local",
      "name": "iPhone 17 Pro(iOS 27.0)-06",
      "enabled": false,
      "model": "iPhone 17 Pro",
      "osVersion": "iOS 27.0",
      "udid": "26FB5C4F-28B3-42D0-BB3A-A7B4D63917FF"
    },
    {
      "platform": "ios",
      "machine": "local",
      "name": "iPhone 17 Pro(iOS 27.0)-07",
      "enabled": false,
      "model": "iPhone 17 Pro",
      "osVersion": "iOS 27.0",
      "udid": "0B7E3ADA-B0E7-4A5B-99A7-B29091AE547A"
    },
    {
      "platform": "ios",
      "machine": "local",
      "name": "iPhone 17 Pro(iOS 27.0)-08",
      "enabled": false,
      "model": "iPhone 17 Pro",
      "osVersion": "iOS 27.0",
      "udid": "257324AF-D10D-42DE-AD7D-ADB682E8365F"
    },
    {
      "platform": "android",
      "machine": "local",
      "name": "Pixel 9(Android 15)-01",
      "avd": "Pixel_9_Android_15_-01"
    },
    {
      "platform": "android",
      "machine": "local",
      "name": "Pixel 9(Android 15)-02",
      "avd": "Pixel_9_Android_15_-02"
    },
    {
      "platform": "android",
      "machine": "local",
      "name": "Pixel 9(Android 15)-03",
      "avd": "Pixel_9_Android_15_-03"
    },
    {
      "platform": "android",
      "machine": "local",
      "name": "Pixel 9(Android 15)-04",
      "avd": "Pixel_9_Android_15_-04"
    },
    {
      "platform": "android",
      "machine": "local",
      "name": "Pixel 9(Android 15)-05",
      "avd": "Pixel_9_Android_15_-05"
    },
    {
      "platform": "android",
      "machine": "local",
      "name": "Pixel 4a",
      "enabled": false,
      "kind": "physical",
      "serial": "14141JEC204922"
    },
    {
      "platform": "android",
      "machine": "local",
      "name": "Pixel 9(Android 15)-06",
      "enabled": false,
      "avd": "Pixel_9_Android_15_-06"
    },
    {
      "platform": "android",
      "machine": "local",
      "name": "Pixel 9(Android 15)-07",
      "enabled": false,
      "avd": "Pixel_9_Android_15_-07"
    },
    {
      "platform": "android",
      "machine": "local",
      "name": "Pixel 9(Android 15)-08",
      "enabled": false,
      "avd": "Pixel_9_Android_15_-08"
    }
  ],
  "heal": true,
  "iosMode": "inapp-boost",
  "record": true,
  "recoverCpuFallbackToGpu": true,
  "wipeDataOnBloat": true
}
