{
  "app": "ft_e2e_ios",
  "devices": [
    {
      "platform": "ios",
      "machine": "M1Max",
      "name": "iPhone 17 Pro(iOS 27.0)-01",
      "model": "iPhone 17 Pro",
      "osVersion": "iOS 27.0",
      "udid": "58CC649F-31C3-4AAA-911A-0BF693395FFD"
    },
    {
      "platform": "ios",
      "machine": "M1Max",
      "name": "iPhone 17 Pro(iOS 27.0)-02",
      "enabled": false,
      "model": "iPhone 17 Pro",
      "osVersion": "iOS 27.0",
      "udid": "400455DE-CDD5-486B-BD3D-42E95202EE40"
    }
  ],
  "heal": true,
  "iosMode": "inapp-boost",
  "wipeDataOnBloat": true
}
