{
  "app": "ft_e2e_ios_device",
  "devices": [
    {
      "platform": "ios",
      "machine": "local",
      "name": "iPhone SE3(実機)",
      "kind": "physical",
      "model": "iPhone SE (3rd generation)",
      "osVersion": "iOS 26.6",
      "udid": "00008110-000260242EEB801E"
    },
    {
      "platform": "ios",
      "machine": "M1Ultra",
      "name": "iPhone 13(実機)",
      "kind": "physical",
      "model": "iPhone 13",
      "osVersion": "iOS 26.6.1",
      "udid": "00008110-001460910E0A201E"
    }
  ],
  "heal": true,
  "iosMode": "inapp-boost"
}
